;job_id;job_title;kualifikasi_pendidikan;spesialist;work_exp;careerLevel;salaryMin;salaryMax;kualifikasi;jobLocation;company_name;company_industry;company_job_type;company_size;job_url;closedAt;postedAt
68;1032520964;Trainer for Jogja - Backfill External Hiring;Tidak terspesifikasi;"Pendidikan/Pelatihan;Pelatihan & Pengembangan";;Tidak Terspesifikasi;;;"Post Date: 24 Jul 2022Requisition #: R1304533Location: Yogyakarta, IndonesiaJob Type: TrainingPlease access the link below for the recruitment data protection notice, applicable for the region where you are applying, or access our Privacy Notice at the bottom of the page if you don’t see the region where you are applying.Data Protection NoticeEssential Functions/Core Responsibilities           Responsible for day-to-day functional direction of agents within the program training classroom environment, including student progress monitoring for the duration of training, providing coaching and developmental feedback and readiness recommendations            Utilize effective presentation and facilitation skills including creative training techniques and adult/accelerated learning techniques using a variety of training delivery modalities in a classroom environment                       Prepare and present training materials through classroom learning, hands on demonstrations, and supporting activities     Accountable for achieving individual training performance metrics                    Support and partner with Operations to transition of agents from training to production environment, ensuring competency levels meet business needs (where required)                     Maintain relevant product knowledge for each account by taking calls, attending client and cross functional meetings (as needed), and side by side observations                      Ensure effective, consistent communication with managers, peers, and other resource groups, including day-to-day informal interaction with clientsMay support Instructional Design team in designing and developing training materials for various instructional delivery methods including; computer-based training, interactive, classroom training, and written job aidsMeasure the effectiveness of training programs using various feedback methods – focus groups, interviews, and surveys that will lead to enhancement of training resources and programs based on results of evaluation Recommend curriculum modifications to Training Manager/Supervisor on the basis of internal customer feedback and/or Training Needs Analysis Participate and contribute to continuous learning culture by maintaining engagement on change management, product and services releases, policies, processes, and procedures           Candidate Profile           Bachelor's Degree in related field from a four-year college or university with two to four years of relevant experience preferred           Proven experience in training methodologies, and soft skills (communication skills, critical thinking, time management, team building, etc.)            Strong communication skills, both written and verbal           Proficient in  Microsoft Office            Demonstrated ability to multi-task, prioritize, and meet timelines on deliverableSelf-starter, sense of urgency, and works well under pressure                      Strong attention to detail                       Sense of professionalism and ability to develop good relationships           Career Framework Role           Requires knowledge and experience in own discipline; still acquiring higher level knowledge and skillsAnalyzes possible solutions using standard procedures and principlesBuilds knowledge of the organization, processes and customers Solves a range of straightforward problemsReceives a moderate level of guidance and directionDisclaimer  The above statements are intended to describe the general nature and level of work being performed by people assigned to this job. They are not intended to be an exhaustive list of all responsibilities, duties, and skills required of personnel working within this job title.Concentrix is an equal opportunity employer. Concentrix evaluates qualified applicants without regard to race, color, religion, gender, national origin, age, sexual orientation, gender identity or expression, protected veteran status, disability status or any other legally protected characteristic.-";Yogyakarta;PT Concentrix Services Indonesia;Call Center/IT-Enabled Services/BPO;;Lebih dari 5000 pekerja;https://www.jobstreet.co.id/id/job/trainer-for-jogja-backfill-external-hiring-1032520964;22/08/2022 16:00;11/08/2022 16:55
69;1032537692;Human Resources Manager;Tidak terspesifikasi;"Sumber Daya Manusia/Personalia;Sumber Daya Manusia / HR";;Tidak Terspesifikasi;;;"Job Number 22127***Job Category Human ResourcesLocation Sheraton Mustika Yogyakarta Resort & Spa, Jalan Laksda Adisucipto Km 8.7, Yogyakarta, Daerah Istimewa Yogyakarta, Indonesia VIEW ON MAPSchedule Full-TimeLocated Remotely? NRelocation? NPosition Type ManagementJOB SUMMARYAssists the Director of Human Resources in executing strategies that serve to attract, retain, and develop diverse premiere talent. Position directs and works with human resource employees to carry out the daily activities of the Human Resource Department, including recruitment, total compensation, employee relations, and training and development. Executes against objectives outlined in the Human Resources Business Plan and delivers services that meet or exceed the needs of employees and enable business success. Ensures compliance with applicable regulations and Standard Operating Procedures.CANDIDATE PROFILEEducation and Experience• High school diploma or GED; 4 years experience in the human resources, management operations, or related professional area.OR• 2-year degree from an accredited university in Human Resources, Business Administration, or related major; 2 years experience in the human resources, management operations, or related professional area.CORE WORK ACTIVITIESManaging the Staffing and Recruiting Process• Ensures open positions are advertised in appropriate venues to attract a diverse candidate pool.• Ensures the open position listing is in a visible location for both internal and external candidates.• Works with Employment Administrator to establish and maintain contact with external recruitment sources (e.g., state job service, local colleges, recruiting agencies, and community based organizations).• Networks with local organization and peers to source candidates for current or future openings (e.g., Hotel Association).• Facilitates interdepartmental transfers and promotions and transfers or promotions to other properties within this property brand.• Oversees the selection and offer processes for hourly employees to ensure proper procedures are followed (e.g., valid reasons for selection/non-selection are documented, applicants receive status notifications).• Partners with department managers and recruiting professionals to recruit management positions, make hiring decisions and negotiate job offers in accordance with SOPs.Managing Legal and Compliance Practices• Ensures compliance with key policies (e.g., Sexual Harassment, Non-Harassment, Non-Discrimination, No Solicitation).• Ensures interviews are conducted according to recommended guidelines, consistent screening criteria is used, and only job-related questions are asked.• Ensures wages are paid in accordance with Standard Operating Procedures and federal and state laws (e.g., employee pay for meeting attendance, wages limited to maximum rate of pay, entry level rates paid to new hires, overtime provisions in place, separation pay).• Ensures drug screening and background checks are completed in accordance with brand's Standard Operating Procedures.Managing Benefits Education and Administration• Manages Workers Compensation claims to ensure appropriate employee care and costs management.• Educates employees on benefits package.• Educates HR team on the various types of benefits available and eligibility requirements.• Provides an overview of employee benefits to the management team enabling them to educate their employees and answer routine questions.• Ensures that department has the available resources on hand to administer employee benefits.Managing and Conducting Staff Development Activities• Ensures hourly performance appraisal processes are in place.• Assists in identifying key drivers of employee satisfaction and supports managers in addressing issues with written plans and actions.• Coaches managers on progressive discipline process.• Ensures development plans are in place (e.g., goals documented, progress towards goal achievement is measured).Managing Employee Relations and Human Resources Communication• Utilizes an “open door” policy to address employee problems or concerns in a timely manner.• Ensures effective employee communication channels are established and active in.• Analyzes accident trends and reports these trends to the management team.• Monitors work environment for signs of union organization.Marriott International is an equal opportunity employer. We believe in hiring a diverse workforce and sustaining an inclusive, people-first culture. We are committed to non-discrimination on any protected basis, such as disability and veteran status, or any other basis covered under applicable law.When you join the Sheraton family, you become a member of its global community. We’ve been a place to gather and connect since 1937. At Sheraton, associates create a sense of belonging in more than 400 communities around the world. We welcome guests through engaging experiences and thoughtful service. If you’re a team player who is excited to deliver a meaningful guest experiences, we encourage you to explore your next career opportunity with Sheraton.-";Yogyakarta;Marriott International;None;;;https://www.jobstreet.co.id/id/job/human-resources-manager-1032537692;24/08/2022 16:00;11/08/2022 15:28
70;1032550717;Education Counselor (Australia) - Yogyakarta;Tidak terspesifikasi;"Pendidikan/Pelatihan;Pendidikan";;Tidak Terspesifikasi;;;An ASX100 business part that is owned by Australian universities, IDP is a pioneer in international education services. Our core business lines include student placement to Australia, US, UK, Canada and New Zealand institutions, English-language testing and training. We are on a mission to build the world's leading platform and connected community to guide students along their journey to achieve their lifelong learning and career aspirations.As a co-owner of IELTS, we deliver the English test that is trusted by more governments, universities and organisations than any other. We also operate English language teaching schools in South East Asia. We are innovators, driven by the needs of our customers and deep data insights. Our 5,000 team members based around the world understand that our services change lives – not only of our customers, but their wider communities. By combining empathy and professional expertise with digital excellence, we create launch pads for our customers to achieve global success. RESPONSIBILITIES Counselling students on Australia studies, providing admission information and assist student with visa application.Communicating with respective Australia universities client.Plan, organise and implement students application and visa processing.Participate in exhibitions or seminar/ interview programs or other outreach activities to convert existing leads, generated by the Marketing / Manager / Other conversion generating activities.Conduct other activities as part of  ‘after sales services’  and to maintain relationship with IDP’s current students & alumniWHAT WE'RE LOOKING FORCandidate must possess at least a Bachelor's Degree, any field.Education counselling skills which include:Basic knowledge of AustraliaBasic knowledge of Australia culture and geographic regionBasic knowledge of Australia university coursesBasic knowledge of visa rules and regulations-;Yogyakarta;IDP International Education Specialists;None;;;https://www.jobstreet.co.id/id/job/education-counselor-australia-yogyakarta-1032550717;25/08/2022 16:00;11/08/2022 15:09
71;1032566292;Game Designer;Tidak terspesifikasi;"Komputer/Teknologi Informasi;IT-Perangkat Lunak";;Tidak Terspesifikasi;;;Company DescriptionAbout Gameloft Leader in the development and publishing of games, Gameloft® has established itself as one of the top innovators in its field since 2000. Gameloft creates games for all digital platforms, two of which are featured in the “Top 10 iOS Games by All-Time Worldwide Downloads” from App Annie. Gameloft operates its own established franchises such as Asphalt®, Dragon Mania Legends, Modern Combat and Dungeon Hunter and also partners with major rights holders including Disney®, LEGO®, Universal, Illumination Entertainment, Hasbro®, Fox Digital Entertainment, Mattel®, Lamborghini® and Ferrari®. Gameloft distributes its games in over 100 countries and employs 3,600 people worldwide. Every month, 70 million unique users can be reached by advertisers in Gameloft games with Gameloft for brands, a leading B2B offering dedicated to brands and agencies. Gameloft is a Vivendi company.All trademarks referenced above are owned by their respective trademark owners.Job DescriptionFrom the beginning of your journey with us you will:Conceptualize and design new features for world class mobile gamesWork on action gameplay, UI layout, game balancing, social features, reward structures, and monetizationWrite documentation, design UI, plan quest flow, and enter balance dataCoordinate the work with art and development teams in order to ensure quality and on time delivery of the projects.Play and analyze competitive games to be an expert in the target genrePitch creative new game ideas for upcoming projectsQualificationsOur ideal candidate will have:Passion for mobile free-to-play games2+ years of experience as a game designer at a mobile game company or equivalent backgroundPost-secondary degree or certificate in a game design related field, or equivalent backgroundExpert knowledge of free-to-play game design fundamentals Understanding of game metrics and key performance indicators (KPIs)Strong ability to communicate ideas through verbal, written and visual meansAbility to quickly adapt in a rapidly changing, fast-paced, and creative environment Aptitude for working under pressure and hitting tight deadlinesCollaborative spirit and love of teamworkCreative imagination and ability to think outside the boxAs a bonus we'll also consider:Practical experience working on a game from initial pitch to live operationDemonstrated passion for game design through personal game projects or game modsExperience working with spreadsheets tools, image editors, and flowchart software Thanks for agreeing to take part in this survey and your interest in our ********** part of our Recruitment process, we would like to know more about your interests when applying in Gameloft. The survey may take you less than 5 minutes to complete, and is totally anonymous. Your honest answers will have no impact on whether you will get the job or not. They will only be used to support our continuous efforts to match our Employer brand with our candidate’s expectations.Please copy the URL below to your web browser in case the link doesn't work properly.***************  Many thanks for your help!Additional Information3 Good ReasonsTo get the best from our people, we aim to give the best: because we owe our success to our talents and their passion.Creating an atmosphere that reflects the company's culture where we value our employee’s expertise, creativity and innovation, we believe this is the key to gain our people’s loyalty.1. Creative workplace with international teams of talents!• Diversity• Modern facilities• Fun environment2. Exciting challenges and rewarding recognitions!• Top-rated and international projects• Performance-base rewards• We value loyalty3. Continuous learning and career growth!• Adaptation to changes• Continuous and initial training• Career developmentWe would like to let you know that we currently work from home (WFH). During WFH, we only accept job applications via online. All application that come by hard file, temporary will not process until further notice.-;Yogyakarta;PT Gameloft Indonesia (Yogyakarta);Hiburan/Media;;501 - 1000 pekerja;https://www.jobstreet.co.id/id/job/game-designer-1032566292;26/08/2022 16:00;11/08/2022 15:54
72;1032566310;Graphic Design Coordinator;Tidak terspesifikasi;"Seni/Media/Komunikasi;Seni / Desain Kreatif";;Tidak Terspesifikasi;;;"Job Number 22129***Job Category Sales & MarketingLocation Yogyakarta Marriott Hotel, Jalan Ringroad Utara, Yogyakarta, Daerah Istimewa Yogyakarta, Indonesia VIEW ON MAPSchedule Full-TimeLocated Remotely? NRelocation? NPosition Type Non-ManagementPOSITION SUMMARYDesigns and produces marketing materials including, but not limited to, advertisements, collateral, signage, flash pieces, electronic brochures and presentations that reflect the brand’s image and style in order to drive hotel revenue. Partners with marketing managers and related operational departments as part of a project team providing design and conceptualization solutions pertaining to deliverables. Maintains familiarity with customer demographics and develops an appropriate look and feel for all promotion and event related collateral. Monitors the progress of all projects, including the maintenance of project files and archives, and provides continuous communication to the Marketing and/or project team regarding ongoing project and status updates. Executes various aspects of production including, printing, scanning, digital retouching, image editing, special effects, and file manipulation and layout.Follow all company policies and procedures; ensure uniform and personal appearance are clean and professional; maintain confidentiality of proprietary information; protect company assets. Welcome and acknowledge all guests according to company standards; anticipate and address guests’ service needs; thank guests with genuine appreciation. Speak with others using clear and professional language; prepare and review written documents accurately and completely; answer telephones using appropriate etiquette. Develop and maintain positive working relationships with others; support team to reach common goals; listen and respond appropriately to the concerns of other employees. Comply with quality assurance expectations and standards. Move, lift, carry, push, pull, and place objects weighing less than or equal to 10 pounds without assistance; stand, sit, or walk for an extended period of time. Perform other reasonable job duties as requested by Supervisors.Marriott International is an equal opportunity employer. We believe in hiring a diverse workforce and sustaining an inclusive, people-first culture. We are committed to non-discrimination on any protected basis, such as disability and veteran status, or any other basis covered under applicable law.Marriott International portfolio of brands includes both JW Marriott and Marriott Hotels.Marriott Hotels, Marriott International’s flagship brand with more than 500 global locations, is advancing the art of hosting so that our guests can travel brilliantly. As a host with Marriott Hotels, you will help keep this promise by delivering premium choices, sophisticated style, and well-crafted details. With your skills and imagination, together we will innovate and reinvent the future of travel.JW Marriott is part of Marriott International's luxury portfolio and consists of more than 80 beautiful properties in gateway cities and distinctive resort locations around the world. JW believes our associates come first. Because if you’re happy, our guests will be happy. It’s as simple as that. Our hotels offer a work experience unlike any other, where you’ll be part of a community and enjoy a true camaraderie with a diverse group of co-workers. JW creates opportunities for training, development, recognition and most importantly, a place where you can really pursue your passions in a luxury environment. Treating guests exceptionally starts with the way we take care of our associates. That’s The JW Treatment™.-";Yogyakarta;Marriott International;None;;;https://www.jobstreet.co.id/id/job/graphic-design-coordinator-1032566310;26/08/2022 16:00;11/08/2022 15:25
73;1032602003;PHP Developer;Tidak terspesifikasi;"Komputer/Teknologi Informasi;IT-Perangkat Lunak";;Tidak Terspesifikasi;;;Company DescriptionBe a Part of Our Global Community!Join the Game!Leader in the development and publishing of games, Gameloft® has established itself as one of the top innovators in its field since 2000. Gameloft creates games for all digital platforms, two of which are featured in the “Top 10 iOS Games by All-Time Worldwide Downloads” from App Annie. Gameloft operates its own established franchises such as Asphalt®, Dragon Mania Legends, Modern Combat and Dungeon Hunter and also partners with major rights holders including Disney®, LEGO®, Universal, Illumination Entertainment, Marvel®, Hasbro®, Fox Digital Entertainment, Mattel®, Lamborghini® and Ferrari®.  Gameloft distributes its games in over 100 countries and employs 4,300 people worldwide. Every month, 80 million unique users can be reached by advertisers in Gameloft games with Gameloft Advertising Solutions, a leading B2B offering dedicated to brands and agencies. Gameloft is a Vivendi company.All trademarks referenced above are owned by their respective trademark owners.Job DescriptionWe are looking for a skilled Full Stack Developer to join our Data team. As part of our team, you will build web-based applications for reporting purposes. Our technology stack consists of various programming languages (PHP, Javascript), popular frameworks (Symfony), database systems (MySQL, Redshift, DynamoDB) and client pivoting solutions (Flexmonster)Work with the team members to translate existing requirements into reporting tools and services according to the client’s needs Develop new features and updates for our reporting tools and APIs Maintain the existing tool and services backend Collaborate with members of the team to help them identify performance bottlenecks and suggest product improvements Participate in the design and requirements specification for the team’s ETL system and data warehouse Qualifications3+ years of experience working with PHP in MVC frameworks like Symfony (preferred, similar MVC framework experience accepted, e.g. Laravel) 3+ years of experience working with JavaScript/jQuery Experience working with HTML/CSS Good SQL query skills and basic RDBMS design experience Experience with Amazon Web Services Strong OOP skills Good English skills Plus: Experience with Git Experience with Gitlab CI/CD Knowledge of REST, JWT, HTTP Basic/Bearer Auth Knowledge of web application security concepts and best practices Experience with NoSQL solutions Experience with UI/UX design Familiar with Jira, Confluence Additional InformationWhy join the Gameloft universe?- Because you want to be part of an exceptional experience, within a company that is constantly growing!- Because you want to work with talented people who are industry pioneers!- Because you want to join a global company and meet great people around the world from all walks of life.- Or, just because you’re looking for a great place to work!What we offer:- Teamwork with international talents- Recognition and rewards- Creative and modern workplace- Continuous and professional training- Work hard, play hardWe can’t wait to find our next great talent!- Please submit your CV, cover letter or portfolio (if applicable)- Please note that only selected candidates will be contacted and your CV will be saved in our files for a period of 6 months.-;Yogyakarta;PT Gameloft Indonesia (Yogyakarta);Hiburan/Media;;501 - 1000 pekerja;https://www.jobstreet.co.id/id/job/php-developer-1032602003;30/08/2022 16:00;11/08/2022 16:55
