;job_id;job_title;kualifikasi_pendidikan;spesialist;work_exp;careerLevel;salaryMin;salaryMax;kualifikasi;jobLocation;company_name;company_industry;company_job_type;company_size;job_url;closedAt;postedAt
63;1032490645;Asst. Recreation Mgr;Tidak terspesifikasi;"Hotel/Restoran;Hotel/Pariwisata";;Tidak Terspesifikasi;;;"Job Number 22125***Job Category Golf, Fitness, & EntertainmentLocation Sheraton Mustika Yogyakarta Resort & Spa, Jalan Laksda Adisucipto Km 8.7, Yogyakarta, Daerah Istimewa Yogyakarta, Indonesia VIEW ON MAPSchedule Full-TimeLocated Remotely? NRelocation? NPosition Type ManagementJOB SUMMARYAssists with managing aspects of the pool and beach areas, including overall maintenance, daily upkeep, cleanliness and the operation of cabana units. Provides and models service behavior to guests and employees. Assists with continually striving to improve guest and employee satisfaction and maximizing the financial performance in areas of responsibility. Position works with direct reports to carry out departmental strategies.CANDIDATE PROFILEEducation and Experience• High school diploma or GED; 1 year experience in the recreation/health club operations or related professional area.OR• 2-year degree from an accredited university in Health Education, Physical Education, Hotel and Restaurant Management, or related major; no work experience required.CORE WORK ACTIVITIESAssisting with Recreation Operations• Supervises and manages employees. Supports day-to-day operations. Understands employee positions well enough to perform duties in employees' absence.• Monitors quality, standards and meets the expectations of the customers on a daily basis.• Demonstrates knowledge of job-relevant issues, products, systems, and processes.• Schedules events, programs, and activities, as well as the work of others.• Provides personal assistance, medical attention, emotional support, or other personal care to others such as coworkers, customers, or patients.• Develops specific goals and plans to prioritize, organize, and accomplish work.• Supports the management of outside vendors including water sports and scuba.• Assists with managing group activities including sand painting, bon fires, and team building events.• Orders and manages necessary supplies. Ensures workers have supplies, equipment, tools, and uniforms necessary to do their jobs.• Assists with managing the children's program (e.g., coordinates activities, purchases equipment and supplies etc.).• Assists with managing pool and beach areas, including overall maintenance, daily upkeep and cleanliness, and the operation of cabana units.Providing and Ensuring Exceptional Customer Service• Serves as a role model to demonstrate appropriate behaviors.• Provides services that are above and beyond for customer satisfaction and retention.• Improves service by communicating and assisting individuals to understand guest needs, provides guidance, feedback, and individual coaching when needed.Conducting Human Resources Activities• Identifies the developmental needs of others and coaches, mentors, or otherwise helps others to improve their knowledge or skills.• Participates in the performance appraisal system process, giving feedback when needed.• Coordinates training activities for employees in department.• Encourages and builds mutual trust, respect, and cooperation among team members.• Communicates expectations and performance objectives to subordinates; subordinates are also open to raise questions and/or concerns.Marriott International is an equal opportunity employer. We believe in hiring a diverse workforce and sustaining an inclusive, people-first culture. We are committed to non-discrimination on any protected basis, such as disability and veteran status, or any other basis covered under applicable law.When you join the Sheraton family, you become a member of its global community. We’ve been a place to gather and connect since 1937. At Sheraton, associates create a sense of belonging in more than 400 communities around the world. We welcome guests through engaging experiences and thoughtful service. If you’re a team player who is excited to deliver a meaningful guest experiences, we encourage you to explore your next career opportunity with Sheraton.-";Yogyakarta;Marriott International;None;;;https://www.jobstreet.co.id/id/job/asst.-recreation-mgr-1032490645;20/08/2022 16:00;11/08/2022 15:16
64;1032520825;Director of Human Resources;Tidak terspesifikasi;"Sumber Daya Manusia/Personalia;Sumber Daya Manusia / HR";;Tidak Terspesifikasi;;;"Job Number 22125***Job Category Human ResourcesLocation Yogyakarta Marriott Hotel, Jalan Ringroad Utara, Yogyakarta, Daerah Istimewa Yogyakarta, Indonesia VIEW ON MAPSchedule Full-TimeLocated Remotely? NRelocation? NPosition Type ManagementJOB SUMMARYThe Director of Human Resources will report directly to the property General Manager, with a dotted-line (functional) reporting relationship to the Regional Senior Director of Human Resources and will be an integral member of the property executive committee. As a member of the Human Resources organization, he/she contributes a high level of human resource generalist knowledge and expertise for a designated property. He/she will be accountable for talent acquisition, succession/workforce planning, performance management and development for property employees, using technology efficiently, and coaching/developing others to help influence and execute business objectives in the most efficient manner. He/she generally works with considerable independence, developing processes to accomplish objectives in alignment with broader business objectives. Additionally, he/she utilizes a Human Resource Business Plan aligned with property and brand strategies to deliver HR services that enable business success.CANDIDATE PROFILEEducation and Experience• 2-year degree from an accredited university in Human Resources, Business Administration, or related major; 4 years experience in the human resources, management operations, or related professional area.OR• 4-year bachelor's degree in Human Resources, Business Administration, or related major; 2 years experience in the human resources, management operations, or related professional area.CORE WORK ACTIVITIESManaging the Human Resources Strategy• Executes and follows-up on engagement survey related activities.• Champions and builds the talent management ranks in support of property and region diversity strategy.• Translates business priorities into property Human Resources strategies, plans and actions• Implements and sustains Human Resources initiatives at the property.• Coordinates the human capital review process at property(s) and leads succession planning activities on property and in the market, as appropriate.• Leads the assessment of property(s) leadership pipeline through the human capital review process and assists with follow-up.• Creates value through proactive approaches that will affect performance outcome or control cost.• Monitors effective use of myHR by property managers and employees.• Leads and participates in succession management and workforce planning.• Responsible for Human Resources strategy and execution.• Serves as key change manager for initiatives that have high employee impact.• Attends owners meetings as a member of the property executive committee and provides meaning or context to the Human Resources results (e.g., retention statistics, critical open positions, employee satisfaction, and training initiatives and results); and demonstrates an understanding of owner priorities.• Supervises one or more on-property Human Resources, as well as market-based Human Resources Specialist type resources where appropriate.Managing Staffing and Recruitment Process• Analyzes open positions to balance the development of existing talent and business needs.• Serves as coach and expert facilitator of the selection and interviewing process.• Surfaces opportunities in work processes and staffing optimization.• Makes staffing decisions to manage the talent cadre and pipeline at the property.• Develops staffing strategy (in collaboration with hiring manager) relating to hiring practices; consults with hiring manager on compensation, benefits, etc.• Monitors sourcing process and outcomes of staffing process.• Ensures managers are competent in assessing and evaluating hourly staff.Managing Employee Compensation Strategy• Remains current and knowledgeable in the internal and external compensation and work competitive environments.• Leads the planning of the hourly employee total compensation strategy.• Champions the communication and proper use of total compensation systems, tools, programs, policies, etc.• Participates in quarterly internal equity analysis; reviews internal equity reports and surface issues needing resolution.• Creates and implement s total compensation management packages/offers, particularly recognition and incentive programs directed towards property priorities.Managing Staff Development Activities• Ensures completion of the duties and responsibilities of the properties’ Human Resources staff members, as outlined in applicable job description(s).• Ensures property Human Resources staff is properly trained in all employee-related human resource information to appropriately respond to property employees.• Serves as resource to property Human Resources staff on employee relations questions and issues.• Continually reinforces positive employee relations concepts.Marriott International is an equal opportunity employer. We believe in hiring a diverse workforce and sustaining an inclusive, people-first culture. We are committed to non-discrimination on any protected basis, such as disability and veteran status, or any other basis covered under applicable law.Marriott International portfolio of brands includes both JW Marriott and Marriott Hotels.Marriott Hotels, Marriott International’s flagship brand with more than 500 global locations, is advancing the art of hosting so that our guests can travel brilliantly. As a host with Marriott Hotels, you will help keep this promise by delivering premium choices, sophisticated style, and well-crafted details. With your skills and imagination, together we will innovate and reinvent the future of travel.JW Marriott is part of Marriott International's luxury portfolio and consists of more than 80 beautiful properties in gateway cities and distinctive resort locations around the world. JW believes our associates come first. Because if you’re happy, our guests will be happy. It’s as simple as that. Our hotels offer a work experience unlike any other, where you’ll be part of a community and enjoy a true camaraderie with a diverse group of co-workers. JW creates opportunities for training, development, recognition and most importantly, a place where you can really pursue your passions in a luxury environment. Treating guests exceptionally starts with the way we take care of our associates. That’s The JW Treatment™.-";Yogyakarta;Marriott International;None;;;https://www.jobstreet.co.id/id/job/director-of-human-resources-1032520825;23/08/2022 16:00;11/08/2022 15:41
65;1032520910;Barista;Tidak terspesifikasi;"Hotel/Restoran;Makanan/Minuman/Pelayanan Restoran";;Tidak Terspesifikasi;;;Job Number 22126***Job Category Food and Beverage & CulinaryLocation Yogyakarta Marriott Hotel, Jalan Ringroad Utara, Yogyakarta, Daerah Istimewa Yogyakarta, Indonesia VIEW ON MAPSchedule Full-TimeLocated Remotely? NRelocation? NPosition Type Non-ManagementSee where your journey can take you. At Marriott International, we believe in seizing opportunities and making your own adventure. A world of opportunity pulls up to your bar with every guest you meet – and you never know who might show up next. That big world also extends to our global, diverse family of associates. Like most families, we’re a group of unique individuals who bring different strengths, styles, personalities and interests to the table. And this makes every single day a new discovery. So, we ask, where will your journey take you?The impact you’ll make You are a bright mixologist who is always on the lookout for new beverage trends. When you are behind the bar, you create an energy that is both welcoming and exciting. You take pride in offering our guests a diverse and seasonally-inspired beverage menu, a warm conversation, and helpful suggestions. When you shine, our guests will look forward to relaxing with you after a long day.Rewards for work, benefits for your lifestyleYou’ll be supported in and out of the workplace through:Discounts on hotel rooms, gift shop items, food and beverageLearning and development opportunitiesRecognition programsWellbeing programsEncouraging managementTeam-spirited colleaguesWhat you’ll doWelcome guestsAttend to tablesOpen and serve wine/champagnePrepare garnishesStock ice, glassware and paper suppliesSet up and maintain cleanliness of bar areaProcess all payment methods and complete cashier reportsWhat we’re looking forGreat storytelling skillsPositive outlook and outgoing personalityPrevious bartending experience is a big plus.This role requires the ability to move and lift up to 25 lbs. Standing, sitting or walking for extended periods of time and ensuring a professional appearance in a clean uniform are also required. Prior to employment, we’ll ask you to complete safety training and certification.Connect your passions with a rewarding opportunityYou’re a beverage enthusiast. And with us, you'll get to both refine and showcase your craft of creating cocktails.  Join us and grow through opportunities to explore the business, opening yourself to various career options. No matter your path, we’ll make sure you feel right at home.Marriott International is an equal opportunity employer. We believe in hiring a diverse workforce and sustaining an inclusive, people-first culture. We are committed to non-discrimination on any protected basis, such as disability and veteran status, or any other basis covered under applicable law.Marriott International portfolio of brands includes both JW Marriott and Marriott Hotels.Marriott Hotels, Marriott International’s flagship brand with more than 500 global locations, is advancing the art of hosting so that our guests can travel brilliantly. As a host with Marriott Hotels, you will help keep this promise by delivering premium choices, sophisticated style, and well-crafted details. With your skills and imagination, together we will innovate and reinvent the future of travel.JW Marriott is part of Marriott International's luxury portfolio and consists of more than 80 beautiful properties in gateway cities and distinctive resort locations around the world. JW believes our associates come first. Because if you’re happy, our guests will be happy. It’s as simple as that. Our hotels offer a work experience unlike any other, where you’ll be part of a community and enjoy a true camaraderie with a diverse group of co-workers. JW creates opportunities for training, development, recognition and most importantly, a place where you can really pursue your passions in a luxury environment. Treating guests exceptionally starts with the way we take care of our associates. That’s The JW Treatment™.-;Yogyakarta;Marriott International;None;;;https://www.jobstreet.co.id/id/job/barista-1032520910;23/08/2022 16:00;11/08/2022 15:44
66;1032520957;Director of Revenue Management;Tidak terspesifikasi;"Penjualan / Pemasaran;Penjualan - Korporasi";;Tidak Terspesifikasi;;;"Job Number 22124***Job Category Revenue ManagementLocation Yogyakarta Marriott Hotel, Jalan Ringroad Utara, Yogyakarta, Daerah Istimewa Yogyakarta, Indonesia VIEW ON MAPSchedule Full-TimeLocated Remotely? NRelocation? NPosition Type ManagementJOB SUMMARYResponsible for balancing the financial objectives of different lodging products to maximize total revenues and profit associated with guest rooms. Position is accountable for pricing, positioning and inventory of all hotels within area of purview. Develops and recommends sales strategy for pricing of the transient customer, wholesale, and group segments. Identifies new revenue opportunities and effectively communicates sales strategy and pricing to all key stakeholders. Maintains productive relationships with stakeholders, including hotel General Managers, sales leaders, franchisees and owners.CANDIDATE PROFILEEducation and Experience• 2-year degree from an accredited university in Business Administration, Finance and Accounting, Economics, Hotel and Restaurant Management, or related major; 1 year experience in the revenue management, sales and marketing, or related professional area.OR• 4-year bachelor's degree from an accredited university in Business Administration, Finance and Accounting, Economics, Hotel and Restaurant Management, or related major; no work experience required.CORE WORK ACTIVITIESAnalyzing and Reporting Revenue Management Data• Analyzes information, identifies current and potential problems and proposes solutions.• Analyzes period end and other available systems data to identify trends, future need periods and obstacles to achieving goals.• Generates updates on transient segment each period and continually analyzes transient booking patterns.• Assists with account diagnostics process and validates conclusions.• Maintains accurate reservation system information.• Checks distribution channels regularly for hotel positioning, information accuracy and competitor positioning.• Identifies the underlying principles, reasons, or facts of information by breaking down information or data into separate parts.• Generates and provides accurate and timely results in the form of reports, presentations, etc.• Observes, receives, and otherwise obtains information from all relevant sources.• Submits reports in a timely manner, ensuring delivery deadlines.• Analyzes weekly and monthly STAR information to assist in analyzing past strategies; identifies areas needing improvement, identifies competitor set strengths, and develops strategies to best capture available Market Share.• Analyze STAR information to assist in development of RevPAR Index forecasts.• Generates yearly room revenue budget.Managing Revenue Management Strategy• Provides critical input to property leaders for development of market sales strategy.• Provides revenue management functional expertise and leadership to general managers and property leadership teams• Implements and evaluates revenue tests.• Ensures that sales strategies and rate restrictions are communicated, implemented and modified as market conditions fluctuate.• Assists hotels with pricing and provides input on business evaluation recommendations.• Provides recommendations to improve effectiveness of revenue management processes.• Ensures property diagnostic processes (PDP) are used to maximize revenue and profits.Building Successful Relationships• Communicates brand initiatives, demand and market analysis to hotels/clusters/franchise partners/owners.• Communicates market direction to revenue management, sales and hotel leaders.• Develops constructive and cooperative working relationships with others, and maintains them over time.• Develops and manages internal key stakeholder relationships.• Provides targeted and timely communication of results, achievements and challenges to the stakeholders.Additional Responsibilities• Informs and/or updates executives, peers and subordinates on relevant information in a timely manner.• Enters, transcribes, records, stores, or maintains information in written or electronic form.• Works with other people to gather the information necessary to manage projects, achieve goals, and resolve problems.• Demonstrates knowledge of job-relevant issues, products, systems, and processes.• Provides information to supervisors, co-workers, and subordinates by telephone, in written form, e-mail, or in person.Marriott International is an equal opportunity employer. We believe in hiring a diverse workforce and sustaining an inclusive, people-first culture. We are committed to non-discrimination on any protected basis, such as disability and veteran status, or any other basis covered under applicable law.Marriott International portfolio of brands includes both JW Marriott and Marriott Hotels.Marriott Hotels, Marriott International’s flagship brand with more than 500 global locations, is advancing the art of hosting so that our guests can travel brilliantly. As a host with Marriott Hotels, you will help keep this promise by delivering premium choices, sophisticated style, and well-crafted details. With your skills and imagination, together we will innovate and reinvent the future of travel.JW Marriott is part of Marriott International's luxury portfolio and consists of more than 80 beautiful properties in gateway cities and distinctive resort locations around the world. JW believes our associates come first. Because if you’re happy, our guests will be happy. It’s as simple as that. Our hotels offer a work experience unlike any other, where you’ll be part of a community and enjoy a true camaraderie with a diverse group of co-workers. JW creates opportunities for training, development, recognition and most importantly, a place where you can really pursue your passions in a luxury environment. Treating guests exceptionally starts with the way we take care of our associates. That’s The JW Treatment™.-";Yogyakarta;Marriott International;None;;;https://www.jobstreet.co.id/id/job/director-of-revenue-management-1032520957;23/08/2022 16:00;11/08/2022 15:44
67;1032520960;Data Analyst Intern;Tidak terspesifikasi;"Komputer/Teknologi Informasi;IT-Admin Jaringan/Sistem/Database";;Tidak Terspesifikasi;;;Qiscus is a multichannel conversational platform that helps businesses embrace the new expectations of excellent Customer Experience (CX) through the ability to engage in timely conversations at scale. Data is essential to be taken into consideration for any crucial decision as it provides valuable business insights.We are looking for a data entry and analyst who will optimize and redesign our data pipeline architecture to support product development and data initiatives. We need an individual who is highly passionate in data analysis who possess a problem-solving aptitude. If you find that you fit this role, come join us!What You Will DoTransferring data from paper formats into computer files or database systemsVerify data by comparing it to source documents and Update existing dataRetrieve data from the database or electronic files as requestedPerform regular backups to ensure data preservationResponding to data-related queries and keeping track of theseAnalyze data to identify trendsProducing reports and charts communicating trends within data to non-specialistsPresenting information generated from data to clients and managers.Willing to commit to the program for 6 monthsWhat You Will Bring to the RoleFresh graduates or at least 3rd year students in university are welcome to applyExcellent educational background, preferably in the fields of computer science, statistic, or related fieldsPassionate in learning about data in the information technology sectorExperience using statistical computer languages (R, Python, SQL, etc. or even Excel) is huge plusInterested in data analysis including business data analysisFamiliar with SQL and database structureFamiliar with Google Data Studio is a plusExcellent written and verbal communication skills for coordinating across teamsStrong analytical skills with the ability to collect, organize, analyze, and disseminate significant amounts of information with attention to detail and accuracyAdept at queries, report-writing and presenting findings-;Yogyakarta;PT Qiscus Tekno Indonesia;Komputer/Teknik Informatika (Perangkat Lunak);Magang;1- 50 pekerja;https://www.jobstreet.co.id/id/job/data-analyst-intern-1032520960;20/08/2022 16:00;11/08/2022 15:25
